{"architecture":"hierarchical-polygon-policy-v1","checkpointSha256":"2222222222222222222222222222222222222222222222222222222222222222","contracts":{"action":1,"observation":2,"problem":1,"reward":2,"solution":2},"datasetManifestSha256":"0000000000000000000000000000000000000000000000000000000000000000","dynamicAxes":["instances","candidates"],"files":{"encoder.onnx":"e6ecbbecd434a41c5572830ef2650711314c1bc7ddf8fbf33b500566ed6e565a","placement-head.onnx":"8db39b6846197422685ac6f190e9695ead5b0a1358b60e74805d29305ec6b0e5"},"format":"aipackaging.polygon_policy","limits":{"hiddenSize":16,"maxCandidatesPerPair":250000,"maxInstances":100,"shapeRasterSize":32,"sheetRasterSize":128},"modelId":"synthetic-polygon-policy-smoke","modelSha256":"f0da963bd89840a41a69b1229e951e0207bcc9acd4b404d7a7bb3c0f4896f850","normalization":"polygon-observation-v2","opset":23,"projectVersion":"0.8.0","selection":{"hierarchy":["instance","rotation","position"],"sampling":"splitmix64-categorical-v1","tieBreak":"lowest-current-catalog-index"},"trainingConfigSha256":"1111111111111111111111111111111111111111111111111111111111111111","version":2}
